{
    "verificationId": "verif-2025042115302500",
    "promptType": "TURN2",
    "verificationType": "LAYOUT_VS_CHECKING",
    "messageStructure": {
      "role": "user",
      "content": [
        {
          "type": "text",
          "text": "Now please analyze the SECOND image (Checking Image)\n\nThis image represents the CURRENT state of vending machine VM-3245 that needs verification against the Reference Layout.\n\n**REFERENCE ANALYSIS SUMMARY:**\n- Machine Structure: 6 rows (A-F), 10 columns confirmed\n- All rows were FULL in reference layout\n- Row A-B: Pink \"Mì Hảo Hảo\" products (20 total)\n- Row C-D: Red/white \"Mì modern Lẩu thái\" products (20 total)\n- Row E-F: Green \"Mì Cung Đình\" products (20 total)\n\nYour task:\n1. Analyze the Checking Image following the same 6x10 structure\n2. Compare EACH position with the reference layout above\n3. Identify ALL discrepancies at individual position level\n4. Complete the full verification report\n\nFocus on: product identity, position accuracy, quantity, label visibility\n\nThis verification will be used for inventory management, so accuracy is critical."
        },
        {
          "type": "image",
          "source": {
            "type": "base64",
            "media_type": "image/jpeg",
            "data": "${BASE64_CHECKING_IMAGE}"
          }
        }
      ]
    },
    "imageReference": {
      "imageType": "checking",
      "sourceUrl": "s3://kootoro-checking-bucket/2025-04-21/VM-3245/check_15-30-25.jpg",
      "base64StorageReference": {
        "bucket": "kootoro-state-management-bucket",
        "key": "verif-2025042115302500/images/checking-base64.json"
      }
    },
    "templateVersion": "1.1.0",
    "createdAt": "2025-04-21T15:30:35Z",
    "generationMetadata": {
      "processingTimeMs": 680,
      "promptSource": "TEMPLATE_BASED",
      "contextSources": ["TURN1_ANALYSIS", "IMAGE_METADATA", "LAYOUT_METADATA"]
    }
  }